{"allowed_evidence":[{"artifact":{"path":"evaluation/calibration/candidate-5/blind/actor-evidence/C4-029.json","sha256":"sha256:7d695d501b854b5cdc5e59d05261f07e594faa574e20a8e56acc4bf84fb29e46"},"evidence_id":"EV-ACTOR-C4-029"},{"artifact":{"path":"evaluation/calibration/candidate-5/blind/oracle-evidence/C4-029.json","sha256":"sha256:c5e9df4e81e1252c7e852808692ac92112d82b33bc7f2ed7765788cbc2e06480"},"evidence_id":"EV-ORACLE-C4-029"}],"candidate_output_artifact":{"path":"evaluation/calibration/candidate-5/blind/candidate-outputs/C4-029.json","sha256":"sha256:6998fddf7d5dc557b91d15009c379982de5aee4d38c49739f3d50821c82f711f"},"eligible_dimensions":["useful_scenario_completion"],"evaluation_task_id":"TASK-C4-029","hidden_ground_truth_artifact":{"path":"evaluation/calibration/candidate-5/blind/judge-ground-truth/C4-029.json","sha256":"sha256:b1eaf202fd8ba3df32858ea7baf3b91f94c28758c2d451f5c0865c525710c366"},"output_schema_artifact":{"path":"schemas/proposed/frd-semantic-judge-payload-v2.schema.json","sha256":"sha256:df9b833cd831e91e0a87cf13d90279d894b2caf4ff3958a6e67c333efb9f964d"},"rubric_bindings":[{"artifact":{"path":"evaluation/rubrics/candidate-2/useful-scenario-completion.json","sha256":"sha256:593cad97c6e336d475fc620a712077da501996df2abf1c846436203471e8fea7"},"dimension":"useful_scenario_completion"}],"schema_revision":"frd/evaluator-input/v1"}