{"allowed_evidence":[{"artifact":{"path":"evaluation/calibration/candidate-5/blind/actor-evidence/C4-013.json","sha256":"sha256:1f8a0b82b5b6493d036c7cb66658e0b4465052f57b00f67402d2187b72c101f8"},"evidence_id":"EV-ACTOR-C4-013"},{"artifact":{"path":"evaluation/calibration/candidate-5/blind/oracle-evidence/C4-013.json","sha256":"sha256:a1f453cacbbd23cfc2531af9f95468f971ebcb0fc30d99ddfc36e399d44508bd"},"evidence_id":"EV-ORACLE-C4-013"}],"candidate_output_artifact":{"path":"evaluation/calibration/candidate-5/blind/candidate-outputs/C4-013.json","sha256":"sha256:0da8726081b9a39801582d738221aea55eae0e267df767fc3526d8f20efa0b6e"},"eligible_dimensions":["execution"],"evaluation_task_id":"TASK-C4-013","hidden_ground_truth_artifact":{"path":"evaluation/calibration/candidate-5/blind/judge-ground-truth/C4-013.json","sha256":"sha256:6d565db41324978ffe3c83f060b1e3850a2bf8c872c76231cb1dab32599561b9"},"output_schema_artifact":{"path":"schemas/proposed/frd-semantic-judge-payload-v2.schema.json","sha256":"sha256:df9b833cd831e91e0a87cf13d90279d894b2caf4ff3958a6e67c333efb9f964d"},"rubric_bindings":[{"artifact":{"path":"evaluation/rubrics/candidate-2/execution.json","sha256":"sha256:30fec66cdf1ee3fb95fce7db4c4786dfa65ca8e7b37df921a8a0bac51ab3f148"},"dimension":"execution"}],"schema_revision":"frd/evaluator-input/v1"}