{"allowed_evidence":[{"artifact":{"path":"evaluation/calibration/candidate-5/blind/actor-evidence/C4-021.json","sha256":"sha256:c2b795c075e8f586c9ab841be998656b80e415186426849061aaf9a9b10c3c86"},"evidence_id":"EV-ACTOR-C4-021"},{"artifact":{"path":"evaluation/calibration/candidate-5/blind/oracle-evidence/C4-021.json","sha256":"sha256:aec015d9982989f4f7b40e8315a3b4bf951ecfe87c0838be6e3b6bc5592a7313"},"evidence_id":"EV-ORACLE-C4-021"}],"candidate_output_artifact":{"path":"evaluation/calibration/candidate-5/blind/candidate-outputs/C4-021.json","sha256":"sha256:cf83b411d4dc12a7e824644f85f6dfabb5e14f69f201bf5a7fc19e73d185114f"},"eligible_dimensions":["investigation"],"evaluation_task_id":"TASK-C4-021","hidden_ground_truth_artifact":{"path":"evaluation/calibration/candidate-5/blind/judge-ground-truth/C4-021.json","sha256":"sha256:8bd9b0733b37fc120deda941181e4afc58101d3db1280077ea7d8bc929f624b2"},"output_schema_artifact":{"path":"schemas/proposed/frd-semantic-judge-payload-v2.schema.json","sha256":"sha256:df9b833cd831e91e0a87cf13d90279d894b2caf4ff3958a6e67c333efb9f964d"},"rubric_bindings":[{"artifact":{"path":"evaluation/rubrics/candidate-2/investigation.json","sha256":"sha256:207d610ac32f5792841569ea7b378fca63e9c652c1ad90927e10be9d12d8da24"},"dimension":"investigation"}],"schema_revision":"frd/evaluator-input/v1"}