{"allowed_evidence":[{"artifact":{"path":"evaluation/calibration/candidate-5/blind/actor-evidence/C4-002.json","sha256":"sha256:80a57b9d3d1d785542b2aa0e52e936151e3cb725ebed3f916fe01f8d3a10cf2f"},"evidence_id":"EV-ACTOR-C4-002"},{"artifact":{"path":"evaluation/calibration/candidate-5/blind/oracle-evidence/C4-002.json","sha256":"sha256:f0452c7b699caa5b2b9326e57d27e6fa90c018d1d70c6b353633b931ea04f443"},"evidence_id":"EV-ORACLE-C4-002"}],"candidate_output_artifact":{"path":"evaluation/calibration/candidate-5/blind/candidate-outputs/C4-002.json","sha256":"sha256:2d06a73199b6e5f5fe86f69d957040d393f2a73e1c7533ffb167dcedd94c9684"},"eligible_dimensions":["useful_scenario_completion"],"evaluation_task_id":"TASK-C4-002","hidden_ground_truth_artifact":{"path":"evaluation/calibration/candidate-5/blind/judge-ground-truth/C4-002.json","sha256":"sha256:d889cf94622e41852d16351ec53a8bb29c2f22d78f35342dbdb19cac0cf8fd9c"},"output_schema_artifact":{"path":"schemas/proposed/frd-semantic-judge-payload-v2.schema.json","sha256":"sha256:df9b833cd831e91e0a87cf13d90279d894b2caf4ff3958a6e67c333efb9f964d"},"rubric_bindings":[{"artifact":{"path":"evaluation/rubrics/candidate-2/useful-scenario-completion.json","sha256":"sha256:593cad97c6e336d475fc620a712077da501996df2abf1c846436203471e8fea7"},"dimension":"useful_scenario_completion"}],"schema_revision":"frd/evaluator-input/v1"}