{"allowed_evidence":[{"artifact":{"path":"evaluation/calibration/candidate-5/blind/actor-evidence/C4-032.json","sha256":"sha256:b09d8a859715f4b09282c4e51ac683d071ea6ac9af6cb382d67204439069319f"},"evidence_id":"EV-ACTOR-C4-032"},{"artifact":{"path":"evaluation/calibration/candidate-5/blind/oracle-evidence/C4-032.json","sha256":"sha256:b7eb6e8da4956e4bc3251ec26d7c2ce14561c3cea411538f0bfbae1131e10b70"},"evidence_id":"EV-ORACLE-C4-032"}],"candidate_output_artifact":{"path":"evaluation/calibration/candidate-5/blind/candidate-outputs/C4-032.json","sha256":"sha256:1f9425e8b950a19b249ffc193affc536fc897383abd9bd37dff5a0d117bde529"},"eligible_dimensions":["recovery_selection"],"evaluation_task_id":"TASK-C4-032","hidden_ground_truth_artifact":{"path":"evaluation/calibration/candidate-5/blind/judge-ground-truth/C4-032.json","sha256":"sha256:fc2659e8a83d8a049d911999f275c1c6aff3e43b85ebf80e9a4deea9e0bfadca"},"output_schema_artifact":{"path":"schemas/proposed/frd-semantic-judge-payload-v2.schema.json","sha256":"sha256:df9b833cd831e91e0a87cf13d90279d894b2caf4ff3958a6e67c333efb9f964d"},"rubric_bindings":[{"artifact":{"path":"evaluation/rubrics/candidate-2/recovery-selection.json","sha256":"sha256:9893b7fd580b72998998f96fc299250f337f4141a3fe16e16d902c1427e587c5"},"dimension":"recovery_selection"}],"schema_revision":"frd/evaluator-input/v1"}