{"allowed_evidence":[{"artifact":{"path":"evaluation/calibration/candidate-5/blind/actor-evidence/C4-028.json","sha256":"sha256:7edda9dc42e2a7a10f547a0accdc37db5f2e16028506ac15ba44d21ba3c3f8b7"},"evidence_id":"EV-ACTOR-C4-028"},{"artifact":{"path":"evaluation/calibration/candidate-5/blind/oracle-evidence/C4-028.json","sha256":"sha256:bff5cb8cc1953b1ccec0bc2160fc5220f5fbe4930c55d06206f4515dfe00c276"},"evidence_id":"EV-ORACLE-C4-028"}],"candidate_output_artifact":{"path":"evaluation/calibration/candidate-5/blind/candidate-outputs/C4-028.json","sha256":"sha256:bfe826ffa96f9fe1af3b0d4d1cff6541c33ed0c9301f51a7c47b8de8c8bef933"},"eligible_dimensions":["useful_scenario_completion"],"evaluation_task_id":"TASK-C4-028","hidden_ground_truth_artifact":{"path":"evaluation/calibration/candidate-5/blind/judge-ground-truth/C4-028.json","sha256":"sha256:78b688f4a9c398642517016793979a8a0270b59f319f368a59787c3f6ff5c8a9"},"output_schema_artifact":{"path":"schemas/proposed/frd-semantic-judge-payload-v2.schema.json","sha256":"sha256:df9b833cd831e91e0a87cf13d90279d894b2caf4ff3958a6e67c333efb9f964d"},"rubric_bindings":[{"artifact":{"path":"evaluation/rubrics/candidate-2/useful-scenario-completion.json","sha256":"sha256:593cad97c6e336d475fc620a712077da501996df2abf1c846436203471e8fea7"},"dimension":"useful_scenario_completion"}],"schema_revision":"frd/evaluator-input/v1"}