{"allowed_evidence":[{"artifact":{"path":"evaluation/calibration/candidate-5/blind/actor-evidence/C4-035.json","sha256":"sha256:3409bf6d712d87f370464ae9d4d8fcb5922a3550983472b5fee7613f677763fa"},"evidence_id":"EV-ACTOR-C4-035"},{"artifact":{"path":"evaluation/calibration/candidate-5/blind/oracle-evidence/C4-035.json","sha256":"sha256:ac1a235b475356d2ced47256c23c7d0aa07742c72318ce36dcd1394a10a7e947"},"evidence_id":"EV-ORACLE-C4-035"}],"candidate_output_artifact":{"path":"evaluation/calibration/candidate-5/blind/candidate-outputs/C4-035.json","sha256":"sha256:50bf77a227defd2a437fd56601e044dd31469957db09a85e7442d8725dce098b"},"eligible_dimensions":["recovery_selection"],"evaluation_task_id":"TASK-C4-035","hidden_ground_truth_artifact":{"path":"evaluation/calibration/candidate-5/blind/judge-ground-truth/C4-035.json","sha256":"sha256:8b5f055de2463b2e7c805e4d7495a4b1f3ce85f19bb2dc28783793e470e7278e"},"output_schema_artifact":{"path":"schemas/proposed/frd-semantic-judge-payload-v2.schema.json","sha256":"sha256:df9b833cd831e91e0a87cf13d90279d894b2caf4ff3958a6e67c333efb9f964d"},"rubric_bindings":[{"artifact":{"path":"evaluation/rubrics/candidate-2/recovery-selection.json","sha256":"sha256:9893b7fd580b72998998f96fc299250f337f4141a3fe16e16d902c1427e587c5"},"dimension":"recovery_selection"}],"schema_revision":"frd/evaluator-input/v1"}