{"allowed_evidence":[{"artifact":{"path":"evaluation/calibration/candidate-5/blind/actor-evidence/C4-005.json","sha256":"sha256:ecf5d914098953958790a879793e51b7d9523bd843813c061423bb857ae87a3f"},"evidence_id":"EV-ACTOR-C4-005"},{"artifact":{"path":"evaluation/calibration/candidate-5/blind/oracle-evidence/C4-005.json","sha256":"sha256:6e545bb4df8bffacab4592ef769878f10f872e790934f42705e9596566f25aa2"},"evidence_id":"EV-ORACLE-C4-005"}],"candidate_output_artifact":{"path":"evaluation/calibration/candidate-5/blind/candidate-outputs/C4-005.json","sha256":"sha256:255d788ecd1e040a6a638abc8a2b8d0439444e6cc77a903dcaa9e64e2f035fd2"},"eligible_dimensions":["useful_scenario_completion"],"evaluation_task_id":"TASK-C4-005","hidden_ground_truth_artifact":{"path":"evaluation/calibration/candidate-5/blind/judge-ground-truth/C4-005.json","sha256":"sha256:5896c4df090168733f3fcba9bf9e37cf7d84c2de7d1394d71088c88c1e239aed"},"output_schema_artifact":{"path":"schemas/proposed/frd-semantic-judge-payload-v2.schema.json","sha256":"sha256:df9b833cd831e91e0a87cf13d90279d894b2caf4ff3958a6e67c333efb9f964d"},"rubric_bindings":[{"artifact":{"path":"evaluation/rubrics/candidate-2/useful-scenario-completion.json","sha256":"sha256:593cad97c6e336d475fc620a712077da501996df2abf1c846436203471e8fea7"},"dimension":"useful_scenario_completion"}],"schema_revision":"frd/evaluator-input/v1"}