{"allowed_evidence":[{"artifact":{"path":"evaluation/calibration/candidate-5/blind/actor-evidence/C4-030.json","sha256":"sha256:262803c86a8a84d69815cc887e2f4588c501bad1e0274dfcd3864eb6cd67689c"},"evidence_id":"EV-ACTOR-C4-030"},{"artifact":{"path":"evaluation/calibration/candidate-5/blind/oracle-evidence/C4-030.json","sha256":"sha256:1d75ff2ade05a09791034fa92b88b0f94ef22d2d66981b8bc625bf4ad8bfc2ec"},"evidence_id":"EV-ORACLE-C4-030"}],"candidate_output_artifact":{"path":"evaluation/calibration/candidate-5/blind/candidate-outputs/C4-030.json","sha256":"sha256:77e6132b303a9951aa973104ac3638f4890a39ac3a24aafc864e96a743d4e820"},"eligible_dimensions":["execution"],"evaluation_task_id":"TASK-C4-030","hidden_ground_truth_artifact":{"path":"evaluation/calibration/candidate-5/blind/judge-ground-truth/C4-030.json","sha256":"sha256:014e3714e05977081c95ccc1ac6e0984a9641f1f0a14bc03f5600305faee8ec6"},"output_schema_artifact":{"path":"schemas/proposed/frd-semantic-judge-payload-v2.schema.json","sha256":"sha256:df9b833cd831e91e0a87cf13d90279d894b2caf4ff3958a6e67c333efb9f964d"},"rubric_bindings":[{"artifact":{"path":"evaluation/rubrics/candidate-2/execution.json","sha256":"sha256:30fec66cdf1ee3fb95fce7db4c4786dfa65ca8e7b37df921a8a0bac51ab3f148"},"dimension":"execution"}],"schema_revision":"frd/evaluator-input/v1"}