{"allowed_evidence":[{"artifact":{"path":"evaluation/calibration/candidate-5/blind/actor-evidence/C4-015.json","sha256":"sha256:4843ef5043ef8023426d01dd319b9de1f6ecd931604fc8faf5a14065ef74d1f4"},"evidence_id":"EV-ACTOR-C4-015"},{"artifact":{"path":"evaluation/calibration/candidate-5/blind/oracle-evidence/C4-015.json","sha256":"sha256:33583959224b93be5c681895dca17dabe5b5cad926e07106079ea70411cd39de"},"evidence_id":"EV-ORACLE-C4-015"}],"candidate_output_artifact":{"path":"evaluation/calibration/candidate-5/blind/candidate-outputs/C4-015.json","sha256":"sha256:62b01dd5c0a9ea54db3b9f2ea41e6853fff8fa296bb9b8855309faf404ff1e02"},"eligible_dimensions":["communication"],"evaluation_task_id":"TASK-C4-015","hidden_ground_truth_artifact":{"path":"evaluation/calibration/candidate-5/blind/judge-ground-truth/C4-015.json","sha256":"sha256:f6c1ef276aabf460d128dcc1726ff3b703dc3f621022583492baa3932ba7a83c"},"output_schema_artifact":{"path":"schemas/proposed/frd-semantic-judge-payload-v2.schema.json","sha256":"sha256:df9b833cd831e91e0a87cf13d90279d894b2caf4ff3958a6e67c333efb9f964d"},"rubric_bindings":[{"artifact":{"path":"evaluation/rubrics/candidate-2/communication.json","sha256":"sha256:5777d4a0cdda87484238c15082c5ff5ed48b3f34771a014bba524c24f9cd4330"},"dimension":"communication"}],"schema_revision":"frd/evaluator-input/v1"}