{"allowed_evidence":[{"artifact":{"path":"evaluation/calibration/candidate-5/blind/actor-evidence/C4-041.json","sha256":"sha256:262a34cf59b90bbe0cf41cade2551074099ab13455bb2e9c85b3d8bfba2c41b5"},"evidence_id":"EV-ACTOR-C4-041"},{"artifact":{"path":"evaluation/calibration/candidate-5/blind/oracle-evidence/C4-041.json","sha256":"sha256:54ad1055a2104d52807cda240a8051f8f204523fe6481ebe755e49308e6ea170"},"evidence_id":"EV-ORACLE-C4-041"}],"candidate_output_artifact":{"path":"evaluation/calibration/candidate-5/blind/candidate-outputs/C4-041.json","sha256":"sha256:ddc8d5ab8420d5cb56397a76b1a82740ae93dcfcf81a747d38846ccf8c7e05b5"},"eligible_dimensions":["communication"],"evaluation_task_id":"TASK-C4-041","hidden_ground_truth_artifact":{"path":"evaluation/calibration/candidate-5/blind/judge-ground-truth/C4-041.json","sha256":"sha256:89541ed713f4042d1405b82cf1d53851b53290f8a0413e9c757061d6c489d436"},"output_schema_artifact":{"path":"schemas/proposed/frd-semantic-judge-payload-v2.schema.json","sha256":"sha256:df9b833cd831e91e0a87cf13d90279d894b2caf4ff3958a6e67c333efb9f964d"},"rubric_bindings":[{"artifact":{"path":"evaluation/rubrics/candidate-2/communication.json","sha256":"sha256:5777d4a0cdda87484238c15082c5ff5ed48b3f34771a014bba524c24f9cd4330"},"dimension":"communication"}],"schema_revision":"frd/evaluator-input/v1"}