{"allowed_evidence":[{"artifact":{"path":"evaluation/calibration/candidate-5/blind/actor-evidence/C4-012.json","sha256":"sha256:af65a0afd8045e8f9dcabc67dbb0f48379934c321815306429c9612abcd7639c"},"evidence_id":"EV-ACTOR-C4-012"},{"artifact":{"path":"evaluation/calibration/candidate-5/blind/oracle-evidence/C4-012.json","sha256":"sha256:e54fa9ea5ee66e60e9fc638bc10fb07da001afd2daa57e2c24e109249a002ce1"},"evidence_id":"EV-ORACLE-C4-012"}],"candidate_output_artifact":{"path":"evaluation/calibration/candidate-5/blind/candidate-outputs/C4-012.json","sha256":"sha256:0cd5eb0d660e0a4f2844b9b65e0387daf65f7cfeabf656635a9d28a59c467fa2"},"eligible_dimensions":["execution"],"evaluation_task_id":"TASK-C4-012","hidden_ground_truth_artifact":{"path":"evaluation/calibration/candidate-5/blind/judge-ground-truth/C4-012.json","sha256":"sha256:03024e5a07f1b64c7002973f95695fdacff8e89814722f6c68a8a7866b8bdea8"},"output_schema_artifact":{"path":"schemas/proposed/frd-semantic-judge-payload-v2.schema.json","sha256":"sha256:df9b833cd831e91e0a87cf13d90279d894b2caf4ff3958a6e67c333efb9f964d"},"rubric_bindings":[{"artifact":{"path":"evaluation/rubrics/candidate-2/execution.json","sha256":"sha256:30fec66cdf1ee3fb95fce7db4c4786dfa65ca8e7b37df921a8a0bac51ab3f148"},"dimension":"execution"}],"schema_revision":"frd/evaluator-input/v1"}