{"allowed_evidence":[{"artifact":{"path":"evaluation/calibration/candidate-5/blind/actor-evidence/C4-006.json","sha256":"sha256:aa4dfa94324ea2572c2c8d7a7e5336853f2f4e235dd940a20d40f1876ff68b58"},"evidence_id":"EV-ACTOR-C4-006"},{"artifact":{"path":"evaluation/calibration/candidate-5/blind/oracle-evidence/C4-006.json","sha256":"sha256:2be7b6d8f475fa7bc7e618635cddf8970bc74cdc25155a9bfaa66d648ab3314a"},"evidence_id":"EV-ORACLE-C4-006"}],"candidate_output_artifact":{"path":"evaluation/calibration/candidate-5/blind/candidate-outputs/C4-006.json","sha256":"sha256:fb733194d74b0d6c272c0e8d2e1a1214656535dbe09d5c45e9763415b9df3a4e"},"eligible_dimensions":["useful_scenario_completion"],"evaluation_task_id":"TASK-C4-006","hidden_ground_truth_artifact":{"path":"evaluation/calibration/candidate-5/blind/judge-ground-truth/C4-006.json","sha256":"sha256:ee66099e2ee2a38e38d28344f49f3231d6fa216d04731632bb52fce6f1c9de70"},"output_schema_artifact":{"path":"schemas/proposed/frd-semantic-judge-payload-v2.schema.json","sha256":"sha256:df9b833cd831e91e0a87cf13d90279d894b2caf4ff3958a6e67c333efb9f964d"},"rubric_bindings":[{"artifact":{"path":"evaluation/rubrics/candidate-2/useful-scenario-completion.json","sha256":"sha256:593cad97c6e336d475fc620a712077da501996df2abf1c846436203471e8fea7"},"dimension":"useful_scenario_completion"}],"schema_revision":"frd/evaluator-input/v1"}