{"allowed_evidence":[{"artifact":{"path":"evaluation/calibration/candidate-5/blind/actor-evidence/C4-020.json","sha256":"sha256:783cee4261e3916f6ce45f23c2a844054c7e84a94a755ffbaae4d755f6233da8"},"evidence_id":"EV-ACTOR-C4-020"},{"artifact":{"path":"evaluation/calibration/candidate-5/blind/oracle-evidence/C4-020.json","sha256":"sha256:0e28f687309d7713788256166814d530f2ae512fba0ed91fcbded5b6be57e94c"},"evidence_id":"EV-ORACLE-C4-020"}],"candidate_output_artifact":{"path":"evaluation/calibration/candidate-5/blind/candidate-outputs/C4-020.json","sha256":"sha256:0143f684ffe28e2c7c60cc4f3a26073e6944b4946fc926691f01c18112c3c0c1"},"eligible_dimensions":["recovery_selection"],"evaluation_task_id":"TASK-C4-020","hidden_ground_truth_artifact":{"path":"evaluation/calibration/candidate-5/blind/judge-ground-truth/C4-020.json","sha256":"sha256:fe69cfcf8c79840a818b20e1f58f84eb406a49794a1d373782ae18756d5b1990"},"output_schema_artifact":{"path":"schemas/proposed/frd-semantic-judge-payload-v2.schema.json","sha256":"sha256:df9b833cd831e91e0a87cf13d90279d894b2caf4ff3958a6e67c333efb9f964d"},"rubric_bindings":[{"artifact":{"path":"evaluation/rubrics/candidate-2/recovery-selection.json","sha256":"sha256:9893b7fd580b72998998f96fc299250f337f4141a3fe16e16d902c1427e587c5"},"dimension":"recovery_selection"}],"schema_revision":"frd/evaluator-input/v1"}