{"allowed_evidence":[{"artifact":{"path":"evaluation/calibration/candidate-5/blind/actor-evidence/C4-031.json","sha256":"sha256:d11ed1e2ded66ffc836a8f88c356df74e27411e667a464b7866494b17e037a47"},"evidence_id":"EV-ACTOR-C4-031"},{"artifact":{"path":"evaluation/calibration/candidate-5/blind/oracle-evidence/C4-031.json","sha256":"sha256:27763e287132a48aa62704939ea4bfb02d3f48a0cdfedbb76c48621b8cd5f895"},"evidence_id":"EV-ORACLE-C4-031"}],"candidate_output_artifact":{"path":"evaluation/calibration/candidate-5/blind/candidate-outputs/C4-031.json","sha256":"sha256:0d669c8c6208a0ae966dd3683e9e084d6b600eae04fe340758986fbff08abd3e"},"eligible_dimensions":["useful_scenario_completion"],"evaluation_task_id":"TASK-C4-031","hidden_ground_truth_artifact":{"path":"evaluation/calibration/candidate-5/blind/judge-ground-truth/C4-031.json","sha256":"sha256:d3ff12036ae76af6a8350a54db93fc7aa3c65a7b2440d282450dc1832f6b13bd"},"output_schema_artifact":{"path":"schemas/proposed/frd-semantic-judge-payload-v2.schema.json","sha256":"sha256:df9b833cd831e91e0a87cf13d90279d894b2caf4ff3958a6e67c333efb9f964d"},"rubric_bindings":[{"artifact":{"path":"evaluation/rubrics/candidate-2/useful-scenario-completion.json","sha256":"sha256:593cad97c6e336d475fc620a712077da501996df2abf1c846436203471e8fea7"},"dimension":"useful_scenario_completion"}],"schema_revision":"frd/evaluator-input/v1"}