{"allowed_evidence":[{"artifact":{"path":"evaluation/calibration/candidate-5/blind/actor-evidence/C4-017.json","sha256":"sha256:b0916d23422101416913a2efb3c83069787a55212de3be4051c666652822f09a"},"evidence_id":"EV-ACTOR-C4-017"},{"artifact":{"path":"evaluation/calibration/candidate-5/blind/oracle-evidence/C4-017.json","sha256":"sha256:ea1ba26edde5d595b5172180b32ed740963d9ea2f227c2ad9b41c626d81f57ab"},"evidence_id":"EV-ORACLE-C4-017"}],"candidate_output_artifact":{"path":"evaluation/calibration/candidate-5/blind/candidate-outputs/C4-017.json","sha256":"sha256:b061b4a29656b69e895766060f91a1a76f88ab681c613234b735bff1b12e8ae4"},"eligible_dimensions":["execution"],"evaluation_task_id":"TASK-C4-017","hidden_ground_truth_artifact":{"path":"evaluation/calibration/candidate-5/blind/judge-ground-truth/C4-017.json","sha256":"sha256:f0bc6b938bbbd9efdf1a337d0ca88ea1aa482845a07fd6c210cee4dab3279488"},"output_schema_artifact":{"path":"schemas/proposed/frd-semantic-judge-payload-v2.schema.json","sha256":"sha256:df9b833cd831e91e0a87cf13d90279d894b2caf4ff3958a6e67c333efb9f964d"},"rubric_bindings":[{"artifact":{"path":"evaluation/rubrics/candidate-2/execution.json","sha256":"sha256:30fec66cdf1ee3fb95fce7db4c4786dfa65ca8e7b37df921a8a0bac51ab3f148"},"dimension":"execution"}],"schema_revision":"frd/evaluator-input/v1"}